{
  "retty_id": "100000024118",
  "slug": "zona-rosa-024118",
  "hp_status": "not_generated",
  "last_crawled": "2026-06-02T15:06:27Z",
  "last_owner_update": null,
  "last_built": null,
  "name": "ZONA ROSA",
  "category": "バル",
  "categories": [
    "バル",
    "メキシコ料理",
    "タコス"
  ],
  "address": "東京都渋谷区恵比寿１-１２-５ 安島ビル B１F",
  "postal_code": "1500013",
  "tel": "03-3440-3878",
  "hours": {
    "mon": {
      "open": "17:00",
      "close": "24:00"
    },
    "tue": {
      "open": "18:00",
      "close": "23:30"
    },
    "wed": {
      "open": "18:00",
      "close": "23:30"
    },
    "thu": {
      "open": "18:00",
      "close": "23:30"
    },
    "fri": {
      "open": "17:00",
      "close": "24:00"
    },
    "holiday": {
      "open": "17:00",
      "close": "24:00"
    },
    "sat": {
      "open": "17:00",
      "close": "24:00"
    }
  },
  "hours_raw": null,
  "budget": {
    "lunch": 1000,
    "dinner": 5000
  },
  "budget_raw": "ランチ予算: 〜1000円 ディナー予算: 〜5000円",
  "geo": {
    "lat": 35.6466433,
    "lng": 139.7121087
  },
  "retty_url": "https://retty.me/area/PRE13/ARE7/SUB701/100000024118/",
  "retty_photos": [
    "https://ximg.retty.me/crop/s1200x900/-/retty/img_ebisu/restaurant/100000024118/archive/947074-5cf08383852bf.jpg",
    "https://ximg.retty.me/crop/s388x388/q80/das/-/retty/img_ebisu/restaurant/100000024118/archive/947074-5cf08383852bf.jpg",
    "https://ximg.retty.me/crop/s388x388/q80/das/-/retty/img_ebisu/restaurant/100000024118/archive/947107-5cf08b2c3554e.jpg",
    "https://ximg.retty.me/crop/s388x388/q80/das/-/retty/img_ebisu/restaurant/100000024118/archive/2021095-5f92afe845538.jpg",
    "https://ximg.retty.me/crop/s388x388/q80/das/-/retty/img_ebisu/restaurant/100000024118/archive/2021105-5f92aff2aec46.jpg",
    "https://ximg.retty.me/crop/s388x388/q80/das/-/retty/img_ebisu/restaurant/100000024118/archive/2021098-5f92afebbaba7.jpg",
    "https://ximg.retty.me/crop/s388x388/q80/das/-/retty/img_ebisu/restaurant/100000024118/archive/946757-5cefc3c90603c.jpg",
    "https://ximg.retty.me/crop/s388x388/q80/das/-/retty/img_ebisu/restaurant/100000024118/archive/946729-5cefc3b17517d.jpg",
    "https://ximg.retty.me/crop/s388x388/q80/das/-/retty/img_ebisu/restaurant/100000024118/archive/2021088-5f92afe11e8a1.jpg",
    "https://ximg.retty.me/crop/s388x388/q80/das/-/retty/img_ebisu/restaurant/100000024118/archive/2021106-5f92aff363ffb.jpg",
    "https://ximg.retty.me/crop/s388x388/q80/das/-/retty/img_ebisu/restaurant/100000024118/archive/2021091-5f92afe43d6cb.jpg",
    "https://ximg.retty.me/crop/s388x388/q80/das/-/retty/img_ebisu/restaurant/100000024118/archive/2021100-5f92afee340a8.jpg",
    "https://ximg.retty.me/crop/s388x388/q80/das/-/retty/img_ebisu/restaurant/100000024118/archive/2021109-5f92aff615308.jpg"
  ],
  "retty_rating": 3.8,
  "retty_review_count": 66,
  "nearest_station": "恵比寿駅徒歩2分",
  "payment_accepted": "カード可 : (VISA,MASTERCARD,AMEX,DINERS,JCB)",
  "owner_message": "",
  "owner_photos": [],
  "featured_menu": [],
  "special_info": "",
  "reservation_url": "https://retty.me/reservation/100000024118",
  "sns": {
    "web": "https://shi-dining.jp/",
    "instagram": "https://www.instagram.com/zonarosa_ebisu/"
  },
  "i18n": {
    "en": {
      "name": "",
      "description": "",
      "featured_menu": []
    },
    "zh": {},
    "ko": {},
    "th": {},
    "vi": {},
    "zh-TW": {}
  }
}
