{
  "retty_id": "100001627389",
  "slug": "store-627389",
  "hp_status": "not_generated",
  "last_crawled": "2026-06-02T13:44:06Z",
  "last_owner_update": null,
  "last_built": null,
  "name": "焼肉 一七三 向山店",
  "category": "焼肉",
  "categories": [
    "焼肉",
    "ステーキ",
    "ホルモン",
    "ハンバーグ"
  ],
  "address": "東京都渋谷区恵比寿南１-１３-３ ５f１-１３-３ GOLDビル ５F",
  "postal_code": "1500022",
  "tel": "03-6452-4646",
  "hours": {
    "mon": {
      "open": "17:00",
      "close": "23:00"
    },
    "tue": {
      "open": "17:00",
      "close": "23:00"
    },
    "wed": {
      "open": "17:00",
      "close": "23:00"
    },
    "thu": {
      "open": "17:00",
      "close": "23:00"
    },
    "fri": {
      "open": "17:00",
      "close": "23:00"
    },
    "sat": {
      "open": "17:00",
      "close": "23:00"
    },
    "holiday": {
      "open": "17:00",
      "close": "23:00"
    }
  },
  "hours_raw": null,
  "budget": {
    "lunch": "営業時間外",
    "dinner": 8000
  },
  "budget_raw": "ランチ予算: 営業時間外 ディナー予算: 〜8000円",
  "geo": {
    "lat": 35.6454966,
    "lng": 139.7103156
  },
  "retty_url": "https://retty.me/area/PRE13/ARE7/SUB701/100001627389/",
  "retty_photos": [
    "https://ximg.retty.me/crop/s1200x900/-/retty/img_repo/2l/01/36158737.jpg"
  ],
  "retty_rating": 4.4,
  "retty_review_count": 9,
  "nearest_station": "JR恵比寿駅西口より徒歩3分",
  "payment_accepted": "カード可 : (VISA,MASTERCARD,AMEX,DINERS,JCB)",
  "owner_message": "",
  "owner_photos": [],
  "featured_menu": [],
  "special_info": "",
  "reservation_url": "",
  "sns": {},
  "i18n": {
    "en": {
      "name": "",
      "description": "",
      "featured_menu": []
    },
    "zh": {},
    "ko": {},
    "th": {},
    "vi": {},
    "zh-TW": {}
  }
}
