{
  "retty_id": "100001751017",
  "slug": "store-751017",
  "hp_status": "not_generated",
  "last_crawled": "2026-06-02T17:01:21Z",
  "last_owner_update": null,
  "last_built": null,
  "name": "おにぎり はやし",
  "category": "和食",
  "categories": [
    "和食"
  ],
  "address": "東京都渋谷区東２-１５-１",
  "postal_code": "1500011",
  "tel": "不明",
  "hours": {},
  "hours_raw": null,
  "budget": {
    "lunch": 1000,
    "dinner": 1000
  },
  "budget_raw": "ランチ予算: 〜1000円 ディナー予算: 〜1000円",
  "geo": {
    "lat": 35.65153775350747,
    "lng": 139.70956024535522
  },
  "retty_url": "https://retty.me/area/PRE13/ARE7/SUB701/100001751017/",
  "retty_photos": [
    "https://ximg.retty.me/crop/s1200x900/-/retty/img_repo/2l/01/35823285.jpg"
  ],
  "retty_rating": 5.0,
  "retty_review_count": 2,
  "nearest_station": null,
  "payment_accepted": null,
  "owner_message": "",
  "owner_photos": [],
  "featured_menu": [],
  "special_info": "",
  "reservation_url": "",
  "sns": {},
  "i18n": {
    "en": {
      "name": "",
      "description": "",
      "featured_menu": []
    },
    "zh": {},
    "ko": {},
    "th": {},
    "vi": {},
    "zh-TW": {}
  }
}
