{
  "retty_id": "100000113840",
  "slug": "store-113840",
  "hp_status": "not_generated",
  "last_crawled": "2026-06-02T22:36:08Z",
  "last_owner_update": null,
  "last_built": null,
  "name": "ラ・ベイエ",
  "category": "フレンチ",
  "categories": [
    "フレンチ",
    "パスタ"
  ],
  "address": "東京都渋谷区恵比寿２-１３-１０ レンブラント広尾１F",
  "postal_code": "1500013",
  "tel": "03-3440-4117",
  "hours": {
    "mon": {
      "open": "18:30",
      "close": "22:30"
    },
    "tue": {
      "open": "18:30",
      "close": "22:30"
    },
    "wed": {
      "open": "18:30",
      "close": "22:30"
    },
    "thu": {
      "open": "18:30",
      "close": "22:30"
    },
    "fri": {
      "open": "18:30",
      "close": "22:30"
    },
    "sat": {
      "open": "18:30",
      "close": "22:30"
    },
    "holiday": {
      "open": "18:30",
      "close": "22:30"
    }
  },
  "hours_raw": null,
  "budget": {
    "lunch": 5000,
    "dinner": 15000
  },
  "budget_raw": "ランチ予算: 〜5000円 ディナー予算: 〜15000円",
  "geo": {
    "lat": 35.6457547,
    "lng": 139.71909970000002
  },
  "retty_url": "https://retty.me/area/PRE13/ARE7/SUB701/100000113840/",
  "retty_photos": [
    "https://ximg.retty.me/crop/s1200x900/-/retty/img_repo/2l/01/35898092.jpg"
  ],
  "retty_rating": 4.85,
  "retty_review_count": 11,
  "nearest_station": null,
  "payment_accepted": "カード可 : (AMEX)",
  "owner_message": "",
  "owner_photos": [],
  "featured_menu": [],
  "special_info": "",
  "reservation_url": "",
  "sns": {},
  "i18n": {
    "en": {
      "name": "",
      "description": "",
      "featured_menu": []
    },
    "zh": {},
    "ko": {},
    "th": {},
    "vi": {},
    "zh-TW": {}
  }
}
