{
  "retty_id": "100000080499",
  "slug": "store-080499",
  "hp_status": "not_generated",
  "last_crawled": "2026-06-02T21:58:01Z",
  "last_owner_update": null,
  "last_built": null,
  "name": "恵比寿 くるり",
  "category": "ダイニングバー",
  "categories": [
    "ダイニングバー",
    "丼もの",
    "たこ焼き",
    "バー"
  ],
  "address": "東京都渋谷区恵比寿西１-７-９ 恵比寿タイムハウスビル３F",
  "postal_code": "1500021",
  "tel": "03-6809-0688",
  "hours": {
    "sun": {
      "open": "17:00",
      "close": "24:00"
    },
    "mon": {
      "open": "17:00",
      "close": "24:00"
    },
    "tue": {
      "open": "17:00",
      "close": "24:00"
    },
    "wed": {
      "open": "17:00",
      "close": "24:00"
    },
    "thu": {
      "open": "17:00",
      "close": "24:00"
    },
    "fri": {
      "open": "17:00",
      "close": "24:00"
    },
    "sat": {
      "open": "17:00",
      "close": "24:00"
    },
    "holiday": {
      "open": "17:00",
      "close": "24:00"
    }
  },
  "hours_raw": null,
  "budget": {
    "lunch": 2000,
    "dinner": 4000
  },
  "budget_raw": "ランチ予算: 〜2000円 ディナー予算: 〜4000円",
  "geo": {
    "lat": 35.64772504373276,
    "lng": 139.70876627942835
  },
  "retty_url": "https://retty.me/area/PRE13/ARE7/SUB701/100000080499/",
  "retty_photos": [
    "https://ximg.retty.me/crop/s1200x900/-/retty/img_repo/2l/01/22373200.jpg"
  ],
  "retty_rating": 4.0,
  "retty_review_count": 39,
  "nearest_station": null,
  "payment_accepted": "カード可 : (AMEX)",
  "owner_message": "",
  "owner_photos": [],
  "featured_menu": [],
  "special_info": "",
  "reservation_url": "",
  "sns": {
    "web": "https://www.kururi-coconote-ebisu.com/",
    "instagram": "https://www.instagram.com/tacoyaki_kururi/"
  },
  "i18n": {
    "en": {
      "name": "",
      "description": "",
      "featured_menu": []
    },
    "zh": {},
    "ko": {},
    "th": {},
    "vi": {},
    "zh-TW": {}
  }
}
