{
  "retty_id": "100001406659",
  "slug": "store-406659",
  "hp_status": "not_generated",
  "last_crawled": "2026-06-02T16:57:35Z",
  "last_owner_update": null,
  "last_built": null,
  "name": "ウェスティンホテル東京 インルームダイニング",
  "category": "ホテル",
  "categories": [
    "ホテル"
  ],
  "address": "東京都目黒区三田１-４-１ ウェスティンホテル東京",
  "postal_code": "1530062",
  "tel": "03-5423-7000",
  "hours": {
    "sun": {
      "open": "00:00",
      "close": "00:00"
    },
    "mon": {
      "open": "00:00",
      "close": "00:00"
    },
    "tue": {
      "open": "00:00",
      "close": "00:00"
    },
    "wed": {
      "open": "00:00",
      "close": "00:00"
    },
    "thu": {
      "open": "00:00",
      "close": "00:00"
    },
    "fri": {
      "open": "00:00",
      "close": "00:00"
    },
    "sat": {
      "open": "00:00",
      "close": "00:00"
    },
    "holiday": {
      "open": "00:00",
      "close": "00:00"
    }
  },
  "hours_raw": null,
  "budget": {
    "lunch": "営業時間外",
    "dinner": "営業時間外"
  },
  "budget_raw": "ランチ予算: 営業時間外 ディナー予算: 営業時間外",
  "geo": {
    "lat": 35.64158805954471,
    "lng": 139.71541803527612
  },
  "retty_url": "https://retty.me/area/PRE13/ARE7/SUB701/100001406659/",
  "retty_photos": [
    "https://ximg.retty.me/crop/s1200x900/-/retty/img_repo/2l/01/19848309.jpg"
  ],
  "retty_rating": 5.0,
  "retty_review_count": 2,
  "nearest_station": null,
  "payment_accepted": null,
  "owner_message": "",
  "owner_photos": [],
  "featured_menu": [],
  "special_info": "",
  "reservation_url": "",
  "sns": {
    "web": "https://www.marriott.com/ja/hotels/tyowi-the-westin-tokyo/overview/"
  },
  "i18n": {
    "en": {
      "name": "",
      "description": "",
      "featured_menu": []
    },
    "zh": {},
    "ko": {},
    "th": {},
    "vi": {},
    "zh-TW": {}
  }
}
