{
  "retty_id": "100001180390",
  "slug": "store-180390",
  "hp_status": "not_generated",
  "last_crawled": "2026-06-02T22:41:20Z",
  "last_owner_update": null,
  "last_built": null,
  "name": "食酒房ふさ助",
  "category": "居酒屋",
  "categories": [
    "居酒屋"
  ],
  "address": "東京都渋谷区恵比寿西２-３-９ 浦－MKYエビスビル １F",
  "postal_code": "1500021",
  "tel": "03-3461-1993",
  "hours": {
    "sun": {
      "open": "18:00",
      "close": "24:00"
    },
    "mon": {
      "open": "18:00",
      "close": "24:00"
    },
    "tue": {
      "open": "18:00",
      "close": "24:00"
    },
    "wed": {
      "open": "18:00",
      "close": "24:00"
    },
    "thu": {
      "open": "18:00",
      "close": "24:00"
    },
    "fri": {
      "open": "18:00",
      "close": "24:00"
    },
    "sat": {
      "open": "18:00",
      "close": "24:00"
    },
    "holiday": {
      "open": "18:00",
      "close": "24:00"
    }
  },
  "hours_raw": null,
  "budget": {
    "lunch": "営業時間外",
    "dinner": 3000
  },
  "budget_raw": "ランチ予算: 営業時間外 ディナー予算: 〜3000円",
  "geo": {
    "lat": 35.649761407854605,
    "lng": 139.7078821061133
  },
  "retty_url": "https://retty.me/area/PRE13/ARE7/SUB701/100001180390/",
  "retty_photos": [
    "https://ximg.retty.me/crop/s1200x900/-/retty/img_repo/2l/01/10204914.jpg"
  ],
  "retty_rating": 4.5,
  "retty_review_count": 7,
  "nearest_station": null,
  "payment_accepted": "カード可 : (AMEX)",
  "owner_message": "",
  "owner_photos": [],
  "featured_menu": [],
  "special_info": "",
  "reservation_url": "",
  "sns": {
    "facebook": "https://www.facebook.com/shokushuboufusasuke/"
  },
  "i18n": {
    "en": {
      "name": "",
      "description": "",
      "featured_menu": []
    },
    "zh": {},
    "ko": {},
    "th": {},
    "vi": {},
    "zh-TW": {}
  }
}
