{
  "retty_id": "100001423114",
  "slug": "base-chic-423114",
  "hp_status": "not_generated",
  "last_crawled": "2026-06-02T16:21:23Z",
  "last_owner_update": null,
  "last_built": null,
  "name": "夜台所 BASE-CHIC",
  "category": "創作料理",
  "categories": [
    "創作料理",
    "おばんざい",
    "無国籍料理",
    "日本酒バー"
  ],
  "address": "東京都渋谷区恵比寿２-９-１ エビスフラット１-A​​",
  "postal_code": "1500013",
  "tel": "03-6277-1902",
  "hours": {
    "mon": {
      "open": "18:30",
      "close": "24:00"
    },
    "tue": {
      "open": "18:30",
      "close": "24:00"
    },
    "wed": {
      "open": "18:30",
      "close": "24:00"
    },
    "thu": {
      "open": "18:30",
      "close": "24:00"
    },
    "fri": {
      "open": "18:30",
      "close": "24:00"
    },
    "sat": {
      "open": "18:30",
      "close": "24:00"
    }
  },
  "hours_raw": null,
  "budget": {
    "lunch": "営業時間外",
    "dinner": 5000
  },
  "budget_raw": "ランチ予算: 営業時間外 ディナー予算: 〜5000円",
  "geo": {
    "lat": 35.64601748882283,
    "lng": 139.71702714601543
  },
  "retty_url": "https://retty.me/area/PRE13/ARE7/SUB701/100001423114/",
  "retty_photos": [
    "https://ximg.retty.me/crop/s1200x900/-/retty/img_repo/2l/01/36645350.jpg"
  ],
  "retty_rating": 4.25,
  "retty_review_count": 12,
  "nearest_station": null,
  "payment_accepted": "カード可 : (AMEX)",
  "owner_message": "",
  "owner_photos": [],
  "featured_menu": [],
  "special_info": "",
  "reservation_url": "",
  "sns": {
    "web": "https://www.base-chic.com/"
  },
  "i18n": {
    "en": {
      "name": "",
      "description": "",
      "featured_menu": []
    },
    "zh": {},
    "ko": {},
    "th": {},
    "vi": {},
    "zh-TW": {}
  }
}
