{
  "retty_id": "100000844710",
  "slug": "store-844710",
  "hp_status": "not_generated",
  "last_crawled": "2026-06-02T16:33:54Z",
  "last_owner_update": null,
  "last_built": null,
  "name": "鮨二斬",
  "category": "寿司",
  "categories": [
    "寿司"
  ],
  "address": "東京都渋谷区恵比寿南２-２９-５ ブルーローズガーデン１階",
  "postal_code": "1500022",
  "tel": "03-5708-5204",
  "hours": {
    "sun": {
      "open": "18:00",
      "close": "22:00"
    },
    "mon": {
      "open": "18:00",
      "close": "22:00"
    },
    "tue": {
      "open": "18:00",
      "close": "22:00"
    },
    "thu": {
      "open": "18:00",
      "close": "22:00"
    },
    "fri": {
      "open": "18:00",
      "close": "22:00"
    },
    "sat": {
      "open": "18:00",
      "close": "22:00"
    },
    "holiday": {
      "open": "18:00",
      "close": "22:00"
    }
  },
  "hours_raw": null,
  "budget": {
    "lunch": 5000,
    "dinner": 15000
  },
  "budget_raw": "ランチ予算: 〜5000円 ディナー予算: 〜15000円",
  "geo": {
    "lat": 35.6422173827,
    "lng": 139.711191944
  },
  "retty_url": "https://retty.me/area/PRE13/ARE7/SUB701/100000844710/",
  "retty_photos": [
    "https://ximg.retty.me/crop/s1200x900/-/retty/img_repo/2l/01/36806029.jpg"
  ],
  "retty_rating": 3.75,
  "retty_review_count": 7,
  "nearest_station": null,
  "payment_accepted": "カード可 : (AMEX)",
  "owner_message": "",
  "owner_photos": [],
  "featured_menu": [],
  "special_info": "",
  "reservation_url": "",
  "sns": {
    "web": "https://www.sushi-nigiri.com/"
  },
  "i18n": {
    "en": {
      "name": "",
      "description": "",
      "featured_menu": []
    },
    "zh": {},
    "ko": {},
    "th": {},
    "vi": {},
    "zh-TW": {}
  }
}
