{
  "retty_id": "100001356251",
  "slug": "store-356251",
  "hp_status": "not_generated",
  "last_crawled": "2026-06-02T22:01:59Z",
  "last_owner_update": null,
  "last_built": null,
  "name": "匠 鮨 おわな",
  "category": "寿司",
  "categories": [
    "寿司"
  ],
  "address": "東京都渋谷区恵比寿南１-１７-１７ TIMEZONEテラスビル４F",
  "postal_code": "1500022",
  "tel": "03-5725-2020",
  "hours": {
    "sun": {
      "open": "18:00",
      "close": "23:00"
    },
    "tue": {
      "open": "18:00",
      "close": "23:00"
    },
    "wed": {
      "open": "18:00",
      "close": "23:00"
    },
    "thu": {
      "open": "18:00",
      "close": "23:00"
    },
    "fri": {
      "open": "18:00",
      "close": "23:00"
    },
    "sat": {
      "open": "18:00",
      "close": "23:00"
    }
  },
  "hours_raw": null,
  "budget": {
    "lunch": "営業時間外",
    "dinner": 30000
  },
  "budget_raw": "ランチ予算: 営業時間外 ディナー予算: 〜30000円",
  "geo": {
    "lat": 35.6447707,
    "lng": 139.71042439999997
  },
  "retty_url": "https://retty.me/area/PRE13/ARE7/SUB701/100001356251/",
  "retty_photos": [
    "https://ximg.retty.me/crop/s1200x900/-/retty/img_repo/2l/01/30657592.jpg"
  ],
  "retty_rating": 4.65,
  "retty_review_count": 15,
  "nearest_station": null,
  "payment_accepted": null,
  "owner_message": "",
  "owner_photos": [],
  "featured_menu": [],
  "special_info": "",
  "reservation_url": "",
  "sns": {},
  "i18n": {
    "en": {
      "name": "",
      "description": "",
      "featured_menu": []
    },
    "zh": {},
    "ko": {},
    "th": {},
    "vi": {},
    "zh-TW": {}
  }
}
