{
  "retty_id": "100000112911",
  "slug": "store-112911",
  "hp_status": "not_generated",
  "last_crawled": "2026-06-02T22:33:51Z",
  "last_owner_update": null,
  "last_built": null,
  "name": "新川",
  "category": "寿司",
  "categories": [
    "寿司"
  ],
  "address": "東京都渋谷区恵比寿１-６-６ 斎藤ビル１F",
  "postal_code": "1500013",
  "tel": "03-3443-6003",
  "hours": {},
  "hours_raw": null,
  "budget": {
    "lunch": 1000,
    "dinner": 10000
  },
  "budget_raw": "ランチ予算: 〜1000円 ディナー予算: 〜10000円",
  "geo": {
    "lat": 35.647707,
    "lng": 139.71094760000005
  },
  "retty_url": "https://retty.me/area/PRE13/ARE7/SUB701/100000112911/",
  "retty_photos": [
    "https://ximg.retty.me/crop/s1200x900/-/retty/img_repo/2l/01/32786373.jpg"
  ],
  "retty_rating": 3.25,
  "retty_review_count": 4,
  "nearest_station": null,
  "payment_accepted": null,
  "owner_message": "",
  "owner_photos": [],
  "featured_menu": [],
  "special_info": "",
  "reservation_url": "",
  "sns": {},
  "i18n": {
    "en": {
      "name": "",
      "description": "",
      "featured_menu": []
    },
    "zh": {},
    "ko": {},
    "th": {},
    "vi": {},
    "zh-TW": {}
  }
}
