{
  "retty_id": "100001773456",
  "slug": "nem-773456",
  "hp_status": "not_generated",
  "last_crawled": "2026-06-02T23:01:27Z",
  "last_owner_update": null,
  "last_built": null,
  "name": "NEM",
  "category": "カフェ",
  "categories": [
    "カフェ"
  ],
  "address": "東京都渋谷区恵比寿４-５-２１ 池田聖徳ビル １F",
  "postal_code": "1500013",
  "tel": "不明",
  "hours": {},
  "hours_raw": null,
  "budget": {
    "lunch": 2000,
    "dinner": "営業時間外"
  },
  "budget_raw": "ランチ予算: 〜2000円 ディナー予算: 営業時間外",
  "geo": {
    "lat": 35.6446475595628,
    "lng": 139.71189993158865
  },
  "retty_url": "https://retty.me/area/PRE13/ARE7/SUB701/100001773456/",
  "retty_photos": [
    "https://ximg.retty.me/crop/s1200x900/-/retty/img_repo/2l/01/37568674.jpg"
  ],
  "retty_rating": 5.0,
  "retty_review_count": 1,
  "nearest_station": null,
  "payment_accepted": null,
  "owner_message": "",
  "owner_photos": [],
  "featured_menu": [],
  "special_info": "",
  "reservation_url": "",
  "sns": {},
  "i18n": {
    "en": {
      "name": "",
      "description": "",
      "featured_menu": []
    },
    "zh": {},
    "ko": {},
    "th": {},
    "vi": {},
    "zh-TW": {}
  }
}
