{
  "retty_id": "100001741402",
  "slug": "hosomichi-741402",
  "hp_status": "not_generated",
  "last_crawled": "2026-06-02T23:07:24Z",
  "last_owner_update": null,
  "last_built": null,
  "name": "Hosomichi",
  "category": "定食",
  "categories": [
    "定食"
  ],
  "address": "東京都渋谷区恵比寿西２-８-１１ グランベルⅣ ２F",
  "postal_code": "1500021",
  "tel": "不明",
  "hours": {},
  "hours_raw": null,
  "budget": {
    "lunch": 2000,
    "dinner": "営業時間外"
  },
  "budget_raw": "ランチ予算: 〜2000円 ディナー予算: 営業時間外",
  "geo": {
    "lat": 35.6495351,
    "lng": 139.7075519
  },
  "retty_url": "https://retty.me/area/PRE13/ARE7/SUB701/100001741402/",
  "retty_photos": [
    "https://ximg.retty.me/crop/s1200x900/-/retty/img_repo/2l/01/34766558.jpg"
  ],
  "retty_rating": 5.0,
  "retty_review_count": 1,
  "nearest_station": null,
  "payment_accepted": null,
  "owner_message": "",
  "owner_photos": [],
  "featured_menu": [],
  "special_info": "",
  "reservation_url": "",
  "sns": {},
  "i18n": {
    "en": {
      "name": "",
      "description": "",
      "featured_menu": []
    },
    "zh": {},
    "ko": {},
    "th": {},
    "vi": {},
    "zh-TW": {}
  }
}
