{
  "retty_id": "100001204087",
  "slug": "tokyo-204087",
  "hp_status": "not_generated",
  "last_crawled": "2026-06-02T15:34:08Z",
  "last_owner_update": null,
  "last_built": null,
  "name": "恵比寿 TOKYO",
  "category": "バー",
  "categories": [
    "バー"
  ],
  "address": "東京都渋谷区恵比寿南１-４-４ タイムゾーン小町ビル５F",
  "postal_code": "1500022",
  "tel": "050-5789-4737",
  "hours": {
    "sun": {
      "open": "20:00",
      "close": "05:00"
    },
    "mon": {
      "open": "20:00",
      "close": "05:00"
    },
    "tue": {
      "open": "20:00",
      "close": "05:00"
    },
    "wed": {
      "open": "20:00",
      "close": "05:00"
    },
    "thu": {
      "open": "20:00",
      "close": "05:00"
    },
    "fri": {
      "open": "20:00",
      "close": "05:00"
    },
    "sat": {
      "open": "20:00",
      "close": "05:00"
    },
    "holiday": {
      "open": "20:00",
      "close": "05:00"
    }
  },
  "hours_raw": null,
  "budget": {
    "lunch": "営業時間外",
    "dinner": 3000
  },
  "budget_raw": "ランチ予算: 営業時間外 ディナー予算: 〜3000円",
  "geo": {
    "lat": 35.64635053172019,
    "lng": 139.70923324823377
  },
  "retty_url": "https://retty.me/area/PRE13/ARE7/SUB701/100001204087/",
  "retty_photos": [
    "https://ximg.retty.me/crop/s1200x900/-/retty/img_repo/2l/01/36208692.jpg"
  ],
  "retty_rating": 3.5,
  "retty_review_count": 1,
  "nearest_station": null,
  "payment_accepted": null,
  "owner_message": "",
  "owner_photos": [],
  "featured_menu": [],
  "special_info": "",
  "reservation_url": "",
  "sns": {},
  "i18n": {
    "en": {
      "name": "",
      "description": "",
      "featured_menu": []
    },
    "zh": {},
    "ko": {},
    "th": {},
    "vi": {},
    "zh-TW": {}
  }
}
