{
  "retty_id": "100001538170",
  "slug": "store-538170",
  "hp_status": "not_generated",
  "last_crawled": "2026-06-02T22:14:24Z",
  "last_owner_update": null,
  "last_built": null,
  "name": "ととら",
  "category": "割烹・小料理屋",
  "categories": [
    "割烹・小料理屋",
    "魚介・海鮮料理",
    "そば（蕎麦）"
  ],
  "address": "東京都渋谷区恵比寿４-１０-１８ 京マンション １F",
  "postal_code": "1500013",
  "tel": "03-6277-3428",
  "hours": {
    "sun": {
      "open": "18:00",
      "close": "23:00"
    },
    "mon": {
      "open": "18:00",
      "close": "23:00"
    },
    "tue": {
      "open": "18:00",
      "close": "23:00"
    },
    "wed": {
      "open": "18:00",
      "close": "23:00"
    },
    "thu": {
      "open": "18:00",
      "close": "23:00"
    },
    "fri": {
      "open": "18:00",
      "close": "23:00"
    },
    "sat": {
      "open": "18:00",
      "close": "23:00"
    },
    "holiday": {
      "open": "18:00",
      "close": "23:00"
    }
  },
  "hours_raw": null,
  "budget": {
    "lunch": 2000,
    "dinner": 10000
  },
  "budget_raw": "ランチ予算: 〜2000円 ディナー予算: 〜10000円",
  "geo": {
    "lat": 35.64561481737342,
    "lng": 139.71377378834325
  },
  "retty_url": "https://retty.me/area/PRE13/ARE7/SUB701/100001538170/",
  "retty_photos": [
    "https://ximg.retty.me/crop/s1200x900/-/retty/img_repo/2l/01/36608389.jpg"
  ],
  "retty_rating": 4.6,
  "retty_review_count": 23,
  "nearest_station": "恵比寿駅から徒歩5分",
  "payment_accepted": "カード可 : ()",
  "owner_message": "",
  "owner_photos": [],
  "featured_menu": [],
  "special_info": "",
  "reservation_url": "",
  "sns": {},
  "i18n": {
    "en": {
      "name": "",
      "description": "",
      "featured_menu": []
    },
    "zh": {},
    "ko": {},
    "th": {},
    "vi": {},
    "zh-TW": {}
  }
}
