{
  "retty_id": "100000067342",
  "slug": "store-067342",
  "hp_status": "not_generated",
  "last_crawled": "2026-06-02T21:04:05Z",
  "last_owner_update": null,
  "last_built": null,
  "name": "すがわら",
  "category": "懐石料理",
  "categories": [
    "懐石料理",
    "割烹・小料理屋",
    "和食",
    "日本料理"
  ],
  "address": "東京都渋谷区恵比寿南２-１９-１２",
  "postal_code": "1500022",
  "tel": "050-5304-2727",
  "hours": {
    "mon": {
      "open": "18:30",
      "close": "23:00"
    },
    "tue": {
      "open": "18:30",
      "close": "23:00"
    },
    "wed": {
      "open": "18:30",
      "close": "23:00"
    },
    "thu": {
      "open": "18:30",
      "close": "23:00"
    },
    "fri": {
      "open": "18:30",
      "close": "23:00"
    }
  },
  "hours_raw": null,
  "budget": {
    "lunch": "営業時間外",
    "dinner": 10000
  },
  "budget_raw": "ランチ予算: 営業時間外 ディナー予算: 〜10000円",
  "geo": {
    "lat": 35.6434924947902,
    "lng": 139.7092570380289
  },
  "retty_url": "https://retty.me/area/PRE13/ARE7/SUB701/100000067342/",
  "retty_photos": [
    "https://ximg.retty.me/crop/s1200x900/-/retty/img_ebisu/restaurant/100000067342/archive/2424615-60ebcf8fb6e0a.jpeg",
    "https://ximg.retty.me/crop/s388x388/q80/das/-/retty/img_ebisu/restaurant/100000067342/archive/2424615-60ebcf8fb6e0a.jpeg",
    "https://ximg.retty.me/crop/s388x388/q80/das/-/retty/img_ebisu/restaurant/100000067342/archive/2424617-60ebcf90ed996.jpeg",
    "https://ximg.retty.me/crop/s388x388/q80/das/-/retty/img_ebisu/restaurant/100000067342/archive/2424605-60ebcf7230e3a.jpeg",
    "https://ximg.retty.me/crop/s388x388/q80/das/-/retty/img_ebisu/restaurant/100000067342/archive/2424602-60ebcf58069c1.jpeg",
    "https://ximg.retty.me/crop/s388x388/q80/das/-/retty/img_ebisu/restaurant/100000067342/archive/2424604-60ebcf7197f7f.jpeg",
    "https://ximg.retty.me/crop/s388x388/q80/das/-/retty/img_ebisu/restaurant/100000067342/archive/2424616-60ebcf9064565.jpeg",
    "https://ximg.retty.me/crop/s388x388/q80/das/-/retty/img_ebisu/restaurant/100000067342/archive/2424610-60ebcf7580e7a.jpeg",
    "https://ximg.retty.me/crop/s388x388/q80/das/-/retty/img_ebisu/restaurant/100000067342/archive/2424606-60ebcf72e7666.jpeg",
    "https://ximg.retty.me/crop/s388x388/q80/das/-/retty/img_ebisu/restaurant/100000067342/archive/2424607-60ebcf73726b9.jpeg"
  ],
  "retty_rating": 4.25,
  "retty_review_count": 12,
  "nearest_station": null,
  "payment_accepted": "カード可 : ()",
  "owner_message": "",
  "owner_photos": [],
  "featured_menu": [],
  "special_info": "",
  "reservation_url": "https://retty.me/reservation/100000067342",
  "sns": {},
  "i18n": {
    "en": {
      "name": "",
      "description": "",
      "featured_menu": []
    },
    "zh": {},
    "ko": {},
    "th": {},
    "vi": {},
    "zh-TW": {}
  }
}
